bird_name,scientific_name,family,at_a_glance,conservation_status,habitat,url
Gambel's Quail,Callipepla gambelii,,"The Sonoran desert is home to this distinctive bird. Gambel's Quail is often abundant near desert streams and waterholes, with coveys walking to the water in the morning and evening, giving a variety of clucking and crowing notes. As cities have grown in the desert southwest, these birds have adapted to life in the surrounding suburbs, coming into back yards to eat grain scattered for them. At night, coveys of Gambel's Quail roost in bushes or low trees.",Least Concern,"Arroyos and Canyons, Desert and Arid Habitats, Fields, Meadows, and Grasslands, Shrublands, Savannas, and Thickets, Urban and Suburban Habitats",https://www.audubon.org/field-guide/bird/gambels-quail
Magnificent Frigatebird,Fregata magnificens,,"In North America, Magnificent Frigatebirds are seen most commonly in Florida. However, they also appear regularly along the Gulf Coast, and strays have turned up in many parts of the continent.",Least Concern,"Coasts and Shorelines, Open Ocean",https://www.audubon.org/field-guide/bird/magnificent-frigatebird
Eastern Meadowlark,Sturnella magna,,"A familiar bird, known by the black 'V' on its chest when it sings from a fencepost, or by the flash of white tail feathers when it flushes from the grass. The clear whistled song of the Eastern Meadowlark can be heard in spring in native meadows and prairies, as well as hayfields, pastures, grassy roadsides, and other open country. In North America, this meadowlark lives only east of the Rockies, but other populations are found in Cuba and from eastern Mexico to northern South America. A similar bird in the southwestern U.S., formerly considered a local race of Eastern Meadowlark, was recognized in 2022 as a distinct species, Chihuahuan Meadowlark.",Near Threatened,"Coasts and Shorelines, Desert and Arid Habitats, Fields, Meadows, and Grasslands, Shrublands, Savannas, and Thickets",https://www.audubon.org/field-guide/bird/eastern-meadowlark
Eurasian Collared-Dove,Streptopelia decaocto,,"During the 20th century, this pale dove expanded its range spectacularly from the Middle East all the way across Europe. Introduced accidentally into the Bahamas in 1974, it soon spread to the Florida mainland. Its expansion westward and northward from there since the 1980s has been remarkable, and the species is now common to abundant across much of North America, as far northwest as Oregon and Washington. Oddly, the expansion has not yet penetrated the northeastern states, aside from a few records of strays.",Least Concern,"Coasts and Shorelines, Fields, Meadows, and Grasslands, Forests and Woodlands, Urban and Suburban Habitats",https://www.audubon.org/field-guide/bird/eurasian-collared-dove
Brewer's Blackbird,Euphagus cyanocephalus,,"This is the common blackbird of open country in the West, often seen walking on the ground with short forward jerks of its head. It adapts well to habitats altered by humans, and in places it may walk about on suburban sidewalks or scavenge for crumbs around beachfront restaurants. In winter, Brewer's Blackbirds gather in large flocks, often with other blackbirds, and may be seen foraging in farmland all across the western and southern states.",Least Concern,"Coasts and Shorelines, Desert and Arid Habitats, Fields, Meadows, and Grasslands, Forests and Woodlands, Landfills and Dumps, Shrublands, Savannas, and Thickets, Urban and Suburban Habitats",https://www.audubon.org/field-guide/bird/brewers-blackbird
American Avocet,Recurvirostra americana,,"Around lake shores and tidal flats, especially in the wide-open spaces of the west, flocks of elegant American Avocets wade in the shallows. They often feed while leaning forward, with the tips of their bills in the water and slightly open, filtering tiny food items from just below the surface. Sometimes a flock will feed this way in unison, walking forward, swinging their heads rhythmically from side to side.",Least Concern,"Coasts and Shorelines, Freshwater Wetlands, Lakes, Ponds, and Rivers, Saltwater Wetlands",https://www.audubon.org/field-guide/bird/american-avocet
Mute Swan,Cygnus olor,,"Brought in from Europe as an ornamental addition to parks and estates, the Mute Swan has established itself in a feral state in some parts of North America, mainly in the northeast. In some places, it has become common enough to be unpopular, and it is considered a pest in a few areas. Not really 'mute'; its voice is hoarse and much quieter than those of our native swans, but its wingbeats may be heard as much as a mile away.",Least Concern,"Coasts and Shorelines, Freshwater Wetlands, Lakes, Ponds, and Rivers, Saltwater Wetlands, Urban and Suburban Habitats",https://www.audubon.org/field-guide/bird/mute-swan
Yellow-breasted Chat,Icteria virens,,"A bizarre series of hoots, whistles, and clucks, coming from the briar tangles, announces the presence of the Yellow-breasted Chat. The bird is often hard to see, but sometimes it launches into the air to sing its odd song as it flies, with floppy wingbeats and dangling legs, above the thickets. This bird's plumage and vocalizations suggest a cross between an oversized warbler and a mockingbird, however this unique chatty species stands alone as the only member of its family.",Least Concern,"Arroyos and Canyons, Desert and Arid Habitats, Fields, Meadows, and Grasslands, Forests and Woodlands, Shrublands, Savannas, and Thickets",https://www.audubon.org/field-guide/bird/yellow-breasted-chat
Canada Jay,Perisoreus canadensis,,"A hiker in the north woods sometimes will be followed by a pair of Canada Jays, gliding silently from tree to tree, watching inquisitively. These fluffy jays seem fearless, and they can be a minor nuisance around campsites and cabins, stealing food, earning the nickname 'camp robber.' Tough enough to survive year-round in very cold climates, they store excess food in bark crevices all summer, retrieving it in harsh weather. Surprisingly, they nest and raise their young in late winter and early spring, not during the brief northern summer.",Least Concern,"Forests and Woodlands, High Mountains, Tundra and Boreal Habitats",https://www.audubon.org/field-guide/bird/canada-jay
Scaly-breasted Munia,Lonchura punctulata,,"Native to southern Asia, this small waxbill is a popular cagebird. Escapees from captivity have established wild populations in several parts of the world. The species is now widespread and common in coastal California, from San Jose to San Diego, and other local populations are established around Houston, Texas, at a few spots farther east along the Gulf Coast, and in southern Florida. Usually seen in flocks.",Least Concern,"Fields, Meadows, and Grasslands, Freshwater Wetlands, Shrublands, Savannas, and Thickets",https://www.audubon.org/field-guide/bird/scaly-breasted-munia
Whooping Crane,Grus americana,,"One of the rarest North American birds, and also one of the largest and most magnificent. Once fairly widespread on the northern prairies, it was brought to the brink of extinction in the 1940s, but strict protection has brought the wild population back to well over one hundred. The flock that winters on the central Texas coast flies 2400 miles north to nest in Wood Buffalo National Park in central Canada; this remote breeding area was not discovered until 1954.",Endangered,"Coasts and Shorelines, Fields, Meadows, and Grasslands, Freshwater Wetlands, Saltwater Wetlands",https://www.audubon.org/field-guide/bird/whooping-crane
Ruffed Grouse,Bonasa umbellus,,"A brown or gray-brown, chicken-like bird with slight crest, fan-shaped, black-banded tail, barred flanks, and black 'ruffs' on sides of neck.",Least Concern,"Forests and Woodlands, High Mountains, Shrublands, Savannas, and Thickets",https://www.audubon.org/field-guide/bird/ruffed-grouse
Western Kingbird,Tyrannus verticalis,,"In open country of the west, the Western Kingbird is often seen perched on roadside fences and wires, flying out to snap up insects -- or to harass ravens, hawks, or other large birds that stray too close to the kingbird's nest. Spunky and adaptable, this flycatcher has adjusted well to advancing civilization within its range. It frequently builds its nest where wires attach to utility poles, and may be seen tending its young there even along busy city streets.",Least Concern,"Arroyos and Canyons, Desert and Arid Habitats, Fields, Meadows, and Grasslands, Shrublands, Savannas, and Thickets, Urban and Suburban Habitats",https://www.audubon.org/field-guide/bird/western-kingbird
Blue-winged Teal,Spatula discors,,"Teal are small ducks, fast in flight, flocks twisting and turning in unison. Seemingly a warm-weather duck, the Blue-winged Teal is largely absent from most of North America in the cold months, and winters more extensively in South America than any of our other dabblers. Small groups of Blue-wings often are seen standing on stumps or rocks at the water's edge.",Least Concern,"Coasts and Shorelines, Freshwater Wetlands, Lakes, Ponds, and Rivers, Saltwater Wetlands",https://www.audubon.org/field-guide/bird/blue-winged-teal
Swainson's Thrush,Catharus ustulatus,,"During the peak of migration, Swainson's Thrushes are often very common in woodlots and parks, lurking in the thickets, slipping into fruiting trees to pluck berries. Although they tend to stay out of sight, the patient birder eventually can see them well enough to discern the bold buffy eye-rings that give these birds their alert or startled look. Like the other brown thrushes, Swainson's migrate mostly at night, and their distinctive callnotes can be heard from overhead on clear nights during spring and fall.",Least Concern,"Forests and Woodlands, High Mountains, Shrublands, Savannas, and Thickets, Tundra and Boreal Habitats",https://www.audubon.org/field-guide/bird/swainsons-thrush
Loggerhead Shrike,Lanius ludovicianus,,"In open terrain, this predatory songbird watches from a wire or other high perch, then pounces on its prey: often a large insect, sometimes a small bird or a rodent. The Loggerhead is gradually disappearing from many areas, for reasons that are poorly understood.",Near Threatened,"Desert and Arid Habitats, Fields, Meadows, and Grasslands, Forests and Woodlands, Shrublands, Savannas, and Thickets, Urban and Suburban Habitats",https://www.audubon.org/field-guide/bird/loggerhead-shrike
Pine Grosbeak,Pinicola enucleator,,"A big boreal finch, uncommon but widespread in spruce and fir forests of the North and the high mountains. It is often absurdly tame, allowing very close approach; ironically, this sometimes makes it easy to overlook in dense coniferous forest, since it may sit motionless as a birder walks by. On those occasions when Pine Grosbeaks move south in winter, they may be more conspicuous, often feeding on buds in the bare branches of maples or other trees.",Least Concern,"Forests and Woodlands, High Mountains, Tundra and Boreal Habitats",https://www.audubon.org/field-guide/bird/pine-grosbeak
American Oystercatcher,Haematopus palliatus,,"A very large, unmistakable shorebird of Atlantic and Gulf Coast beaches. Solitary or in family groups in summer, American Oystercatchers may gather in large flocks in winter.",Least Concern,"Coasts and Shorelines, Saltwater Wetlands",https://www.audubon.org/field-guide/bird/american-oystercatcher
Snow Bunting,Plectrophenax nivalis,,"They sometimes have been called 'Snowflakes,' and flocks of Snow Buntings may seem like snowflakes as they swirl through the air and then settle on winter fields. South of the Arctic these are strictly winter birds, arriving in late fall, generally departing at the first signs of spring. In summer they retire to barren northern tundra, with some breeding on the northernmost islands of Canada and the mountains of Greenland. In some high Arctic communities, Snow Buntings nest in birdhouses put out for them.",Least Concern,"Coasts and Shorelines, Fields, Meadows, and Grasslands, Saltwater Wetlands, Tundra and Boreal Habitats",https://www.audubon.org/field-guide/bird/snow-bunting
Harris's Hawk,Parabuteo unicinctus,,"This strikingly patterned southwestern hawk is more sociable than most birds of prey. It is often seen in groups of three or more, the birds perching close together on poles or giant cactus. It may seem lethargic or tame when perched, allowing close approach; when hunting, however, it is dashing and powerful, pursuing prey in agile flight even through dense brush. Two or more Harris's Hawks may hunt cooperatively, working together to chase prey into the open.",Least Concern,"Arroyos and Canyons, Desert and Arid Habitats, Fields, Meadows, and Grasslands, Shrublands, Savannas, and Thickets, Urban and Suburban Habitats",https://www.audubon.org/field-guide/bird/harriss-hawk
Red-eyed Vireo,Vireo olivaceus,,"One of the most numerous summer birds in eastern woods. It is not the most often seen, because it tends to stay out of sight in the leafy treetops, searching methodically among the foliage for insects. However, its song -- a series of short, monotonous phrases, as if it were endlessly asking and answering the same question -- can be heard constantly during the nesting season, even on hot summer afternoons.",Least Concern,"Forests and Woodlands, Shrublands, Savannas, and Thickets",https://www.audubon.org/field-guide/bird/red-eyed-vireo
Great-tailed Grackle,Quiscalus mexicanus,,"Wherever it occurs, this big blackbird is impossible to overlook -- especially the male, with his great oversized tail and incredible variety of callnotes. In the southwest, flocks of Great-tailed Grackles feed in open country during the day, but often come into towns at night, forming noisy roosting aggregations in the trees in city parks. During recent decades, this species has greatly expanded its range within our area, and it is still spreading north in some areas.",Least Concern,"Arroyos and Canyons, Coasts and Shorelines, Desert and Arid Habitats, Fields, Meadows, and Grasslands, Freshwater Wetlands, Lakes, Ponds, and Rivers, Landfills and Dumps, Shrublands, Savannas, and Thickets, Urban and Suburban Habitats",https://www.audubon.org/field-guide/bird/great-tailed-grackle
Long-eared Owl,Asio otus,,"This medium-sized owl is widespread but not particularly well known in North America. It seems to call less often or less conspicuously than many of our other owls, so it may be overlooked in some areas where it nests. In winter, sometimes groups of a dozen or more may be found roosting together in groves of conifers, willows, mesquites, or other trees.",Least Concern,"Forests and Woodlands, High Mountains, Shrublands, Savannas, and Thickets",https://www.audubon.org/field-guide/bird/long-eared-owl
Rough-legged Hawk,Buteo lagopus,,"Of our soaring Buteo hawks, this is the only one tied to cold climates. It nests in the Arctic, mostly in tundra regions north of the boreal forest; in winter, only a few move farther south than the central United States. Its breeding success on the tundra is often dictated by the population cycles of lemmings, which may provide most of the food for the young. The name 'Rough-legged' refers to the feathering that extends down the legs to the base of the toes -- a helpful adaptation for staying warm in frigid weather.",Least Concern,"Fields, Meadows, and Grasslands, Saltwater Wetlands, Tundra and Boreal Habitats",https://www.audubon.org/field-guide/bird/rough-legged-hawk
Northern Shrike,Lanius borealis,,"This tough bird feeds on rodents and smaller birds for much of the year. It spends the summer in the far north, appearing in southern Canada and the lower 48 States only in winter. Solitary and wary, the shrike is likely to be seen perched at the top of a lone tree in an open field, watching for prey.",Least Concern,"Fields, Meadows, and Grasslands, Forests and Woodlands, Freshwater Wetlands, Saltwater Wetlands, Shrublands, Savannas, and Thickets, Tundra and Boreal Habitats",https://www.audubon.org/field-guide/bird/northern-shrike
Prothonotary Warbler,Protonotaria citrea,,"In southeastern swamps in summer, this bright golden warbler sings from high in the trees. It is unique among eastern warblers in its habit of nesting in holes in trees, rather than in the open; it will sometimes nest in birdhouses placed close to the water. The name 'Prothonotary' originally referred to a group of official scribes in the Catholic Church who wore bright yellow hoods, as this bird appears to do.",Least Concern,"Coasts and Shorelines, Forests and Woodlands, Freshwater Wetlands, Saltwater Wetlands, Shrublands, Savannas, and Thickets",https://www.audubon.org/field-guide/bird/prothonotary-warbler
Northern Parula,Setophaga americana,,"This small warbler is often hard to see as it forages in dense foliage of the treetops. However, it is easy to hear; the male seems to repeat his buzzy trickle-up song constantly from early spring through mid-summer at least. Northern Parulas hide their nests inside hanging Spanish moss in the South, or in the similar Usnea lichens in the North, where they are impossible to spot except by the actions of the parent birds.",Least Concern,"Forests and Woodlands, Freshwater Wetlands, Lakes, Ponds, and Rivers, Shrublands, Savannas, and Thickets",https://www.audubon.org/field-guide/bird/northern-parula
Eastern Wood-Pewee,Contopus virens,,"In eastern woods in summer, the plaintive whistled pee-a-wee of this small flycatcher is often heard before the bird is seen. The bird itself is usually somewhere in the leafy middle story of the trees, perched on a bare twig, darting out to catch passing insects. The Wood-Pewee sings most often at dawn and dusk, and it may continue singing quite late in the evening, after most songbirds have fallen silent.",Least Concern,"Forests and Woodlands, Shrublands, Savannas, and Thickets",https://www.audubon.org/field-guide/bird/eastern-wood-pewee
Northern Pygmy-Owl,Glaucidium gnoma,,"In western forests, this little owl is often active by day. It may fly fast and low from one tree to the next and then swoop up to take a high perch, rather like a shrike. An aggressive hunter despite its small size, it catches more birds than most small owls. Little gangs of chickadees and other songbirds often gather to 'mob' a pygmy-owl discovered in daylight, and they will react the same way to a birder who imitates the owl's whistled call.",Least Concern,"Arroyos and Canyons, Forests and Woodlands, High Mountains",https://www.audubon.org/field-guide/bird/northern-pygmy-owl
Blackburnian Warbler,Setophaga fusca,,"A fiery gem of the treetops. In the northern forest in summer, the male Blackburnian Warbler may perch on the topmost twig of a spruce, showing off the flaming orange of his throat as he sings his thin, wiry song. The female also stays high in the conifers, and the nest is usually built far above the ground. Long-distance migrants, most Blackburnians spend the winter in South America, where they are often common in mountain forest in the Andes.",Least Concern,"Forests and Woodlands, Shrublands, Savannas, and Thickets, Tundra and Boreal Habitats",https://www.audubon.org/field-guide/bird/blackburnian-warbler
Cassin's Finch,Haemorhous cassinii,,"Like a slightly larger, longer-billed version of the Purple Finch, Cassin's Finch is a resident of mountains and conifer forests of the West. It is sometimes found at very high elevations, in the scrubby forest just below treeline, especially in late summer. At other times, little roving flocks wander through the woods, often feeding on buds and seeds high in the trees. The complicated song of the male often includes brief imitations of other birds.",Near Threatened,"Arroyos and Canyons, Forests and Woodlands, High Mountains",https://www.audubon.org/field-guide/bird/cassins-finch
American Wigeon,Mareca americana,,"While most dabbling ducks are denizens of the shallows, American Wigeon spend much of their time in flocks grazing on land. Paradoxically, they also spend more time than other marsh ducks on deep water, where they get much of their food by stealing it from other birds such as coots or diving ducks. This duck was once known as 'Baldpate' because of its white crown.",Least Concern,"Coasts and Shorelines, Fields, Meadows, and Grasslands, Freshwater Wetlands, Lakes, Ponds, and Rivers, Saltwater Wetlands, Tundra and Boreal Habitats",https://www.audubon.org/field-guide/bird/american-wigeon
Pied-billed Grebe,Podilymbus podiceps,,"The most widespread grebe in the New World, and the most familiar in most temperate parts of North America. Far less sociable than most grebes, almost never in flocks, sometimes found singly on small marshy ponds. When disturbed or suspicious, it may sink slowly until only head is above water. Rarely seen in flight. Often secretive in the breeding season, hiding in marsh, making bizarre whinnying, gobbling, cooing noises by day or night.",Least Concern,"Coasts and Shorelines, Freshwater Wetlands, Lakes, Ponds, and Rivers, Saltwater Wetlands",https://www.audubon.org/field-guide/bird/pied-billed-grebe
Cliff Swallow,Petrochelidon pyrrhonota,,"This swallow is probably far more common today than when the Pilgrims landed. Originally it built its jug-shaped mud nests on the sides of cliffs. However, the sides of barns and the supports of bridges provided sheltered sites that were far more widespread than the natural ones. Taking advantage of these artificial locations, the species has invaded many areas where it never nested before. Although it is continuing to spread in the east, it is still more common in the west, where practically every culvert and highway bridge seems to have its own Cliff Swallow colony.",Least Concern,"Coasts and Shorelines, Fields, Meadows, and Grasslands, High Mountains, Lakes, Ponds, and Rivers, Shrublands, Savannas, and Thickets, Tundra and Boreal Habitats, Urban and Suburban Habitats",https://www.audubon.org/field-guide/bird/cliff-swallow
California Towhee,Melozone crissalis,,"Along the Pacific seaboard from southern Oregon to Baja, this plain brown bird is a common denizen of brushy places, from wild chaparral hillsides to the borders of gardens and city parks. California Towhees sometimes hide in the shrubbery, where they may be noticed mainly by their sharp callnotes and the squealing duets of mated pairs. At other times they come out on open ground, to scratch in the leaf-litter with both feet as they search for food.",Least Concern,"Forests and Woodlands, Shrublands, Savannas, and Thickets, Urban and Suburban Habitats",https://www.audubon.org/field-guide/bird/california-towhee
Orange-crowned Warbler,Leiothlypis celata,,"One of the plainest of warblers, the orange feathers on its head almost never visible, this species is also among the most hardy. In winter, when most warblers are deep in the tropics, Orange-crowns are common in the southern states. They are usually seen singly, sometimes loosely associated with flocks of other birds. At all seasons they tend to stay fairly low, in bushes or small trees, flicking their tails frequently as they search among the foliage for insects.",Least Concern,"Arroyos and Canyons, Desert and Arid Habitats, Forests and Woodlands, High Mountains, Shrublands, Savannas, and Thickets, Tundra and Boreal Habitats",https://www.audubon.org/field-guide/bird/orange-crowned-warbler
Yellow-throated Warbler,Setophaga dominica,,"A clear-voiced singer in the treetops in southern woodlands. Yellow-throated Warblers return very early in spring to the pine woods and cypress swamps, where they may be seen foraging rather deliberately along branches high in the trees. In the Midwest, they are typically found in riverside groves of sycamores. During the winter in Florida and other tropical areas, they are commonly seen creeping about in the crowns of palms, probing among the fronds with their long bills.",Least Concern,"Forests and Woodlands, Freshwater Wetlands, Saltwater Wetlands, Shrublands, Savannas, and Thickets",https://www.audubon.org/field-guide/bird/yellow-throated-warbler
Greater White-fronted Goose,Anser albifrons,,"In North America, this gray goose is found mainly west of the Mississippi River. Nesting on Arctic tundra, it winters in open country in mild climates. Wintering flocks leave night roosts before sunrise to fly to feeding areas, and musical gabbling and honking can be heard from wavering lines of White-fronts passing overhead at dawn. Included in this species is a large, dark form known as the 'Tule Goose,' nesting in southern Alaska and wintering in central California marshes.",Least Concern,"Coasts and Shorelines, Fields, Meadows, and Grasslands, Freshwater Wetlands, Lakes, Ponds, and Rivers, Saltwater Wetlands, Tundra and Boreal Habitats",https://www.audubon.org/field-guide/bird/greater-white-fronted-goose
Red-cockaded Woodpecker,Dryobates borealis,,"Once fairly common in the southeastern United States, this bird is now rare, local, and considered an endangered species. It requires precise conditions within mature pine forest, a habitat that is now scarce. Lives in isolated clans, each clan an extended family group, with one pair of adults assisted in their nesting by up to four additional birds. The red cockade for which the bird is named, a small patch of feathers behind the eye of the male, is usually hard to see in the field.",Near Threatened,"Forests and Woodlands, Shrublands, Savannas, and Thickets",https://www.audubon.org/field-guide/bird/red-cockaded-woodpecker
