bird_name,scientific_name,family,at_a_glance,conservation_status,habitat,url
MacGillivray's Warbler,Geothlypis tolmiei,,"A skulker in dense western brush, sometimes hard to see but readily located by its hurried song and its hard chip callnote. A close relative of the Mourning Warbler of the East, replacing it from the Rockies westward. Unlike the Mourning, this species is often seen in substantial numbers during migration -- especially in early fall, when practically every thicket in the Southwest seems to have one (but only one) MacGillivray's Warbler.",Least Concern,"Arroyos and Canyons, Desert and Arid Habitats, Forests and Woodlands, Shrublands, Savannas, and Thickets",https://www.audubon.org/field-guide/bird/macgillivrays-warbler
Swainson's Warbler,Limnothlypis swainsonii,,"A shy denizen of southern canebrakes, Swainson's Warbler is more often heard than seen. It spends most of its time on or near the ground in dense cover, walking about in search of insects. Quite plain in appearance, and with a relatively heavy bill, it does not suggest a warbler when it is glimpsed foraging in the undergrowth; however, it may be recognized by its rich musical song, audible from some distance away.",Least Concern,"Coasts and Shorelines, Forests and Woodlands, Freshwater Wetlands",https://www.audubon.org/field-guide/bird/swainsons-warbler
Buff-breasted Sandpiper,Calidris subruficollis,,"A beautiful but strange little sandpiper, its short bill and round head giving it the look of a plover. On migration it typically stops on prairies, fields of short grass, and even dry plowed fields, seemingly odd settings for a shorebird. Formerly an abundant bird, the Buff-breasted Sandpiper suffered serious declines around the beginning of the 20th century, with many shot during their long migration from the Arctic tundra to the pampas of Argentina.",Near Threatened,"Coasts and Shorelines, Fields, Meadows, and Grasslands, Saltwater Wetlands, Tundra and Boreal Habitats",https://www.audubon.org/field-guide/bird/buff-breasted-sandpiper
Black-chinned Sparrow,Spizella atrogularis,,"A small, long-tailed bird of arid southwestern hills, the Black-chinned Sparrow is quite localized and sometimes overlooked. It often nests on steep hillsides covered with dense low scrub, areas that tend to be ignored by birders. In winter it may occur in small flocks, foraging inconspicuously on the ground in brushy areas, sometimes associating with Chipping or Brewer's sparrows. The black chin mentioned in the name is present only on males in breeding plumage.",Least Concern,"Arroyos and Canyons, Desert and Arid Habitats, Forests and Woodlands, Shrublands, Savannas, and Thickets",https://www.audubon.org/field-guide/bird/black-chinned-sparrow
Montezuma Quail,Cyrtonyx montezumae,,"Despite its bold and bizarre pattern, this little quail of the Mexican border regions can be remarkably hard to see. When approached, pairs or coveys of Montezuma Quail may crouch motionless until they are practically stepped upon; then they explode into flight, to whir away across the hillsides. Fall and winter coveys usually have fewer than ten birds, and they often range over a very limited area.",Least Concern,"Arroyos and Canyons, Desert and Arid Habitats, Fields, Meadows, and Grasslands, Forests and Woodlands, Shrublands, Savannas, and Thickets",https://www.audubon.org/field-guide/bird/montezuma-quail
Ancient Murrelet,Synthliboramphus antiquus,,"Elegantly marked, a diving bird of the northern Pacific Coast. More agile in flight than most auks, able to take off directly from water, flocks often banking and turning in unison. Breeding behavior unusual for a seabird: Males 'sing' at night from tree branches and other high perches at nesting colonies; the species regularly raises two young (most auks raise only one); it raises its young at sea, leading them away from the nest within a few days after they hatch. The name 'Ancient' results from gray back, with fancied resemblance to a shawl draped across an old person's shoulders.",Least Concern,"Coasts and Shorelines, Open Ocean",https://www.audubon.org/field-guide/bird/ancient-murrelet
Bell's Sparrow,Artemisiospiza belli,,"Formerly considered part of the same species as the Sagebrush Sparrow, this bird is locally common in sage scrub habitat near the California coast and locally in open habitats of the interior. It is often seen running about on the ground, with its longish tail cocked up above the level of its back; when perched up on a shrub, it twitches its tail in a down-up motion like a phoebe.",Least Concern,"Desert and Arid Habitats, Shrublands, Savannas, and Thickets",https://www.audubon.org/field-guide/bird/bells-sparrow
Neotropic Cormorant,Nannopterum brasilianum,,"Found throughout the American tropics, this lanky diving bird is common in some areas near the Mexican border, and may be gradually extending its range north. Similar to the Double-crested Cormorant but a little smaller, and may be found with it, especially inland or in winter. Formerly called Olivaceous Cormorant.",Least Concern,"Coasts and Shorelines, Freshwater Wetlands, Lakes, Ponds, and Rivers",https://www.audubon.org/field-guide/bird/neotropic-cormorant
Great Skua,Stercorarius skua,,"A big, broad-shouldered, predatory seabird of the North Atlantic. Usually solitary at sea, although concentrations may occur where food is abundant. Breeds mainly in Iceland and on islands north of Great Britain; in North America, it is very seldom seen from shore, although it may be common far offshore during the winter. Closely related forms are common in the Southern Hemisphere, mostly in subantarctic regions.",Least Concern,Open Ocean,https://www.audubon.org/field-guide/bird/great-skua
Eurasian Skylark,Alauda arvensis,,"This is one of the most famous songbirds in the world, celebrated by British poets and naturalists. English settlers in North America tried repeatedly to introduce the skylark to this continent, but they succeeded only on southern Vancouver Island, British Columbia. Present since the early 1900s, there are still a few skylarks around the edges of Victoria, but they are gradually disappearing as development takes over their habitat.",Least Concern,"Fields, Meadows, and Grasslands, Tundra and Boreal Habitats",https://www.audubon.org/field-guide/bird/eurasian-skylark
Island Scrub-Jay,Aphelocoma insularis,,"Larger, darker, and more richly colored than the California Scrub-Jay is this very localized species. It lives only on Santa Cruz Island, a little over 20 miles long and up to five miles wide in places, one of the Channel Islands off the coast of southern California.",Least Concern,"Forests and Woodlands, Shrublands, Savannas, and Thickets",https://www.audubon.org/field-guide/bird/island-scrub-jay
Garganey,Spatula querquedula,,"A long-distance migrant in the Old World, this small duck sometimes goes off course, and might turn up almost anywhere in North America. Most likely to be seen in spring, on marshy ponds of the sort favored by Blue-winged Teal. In the western Aleutian Islands, Alaska, occurs as a rare migrant in spring and very rarely in fall.",Least Concern,"Freshwater Wetlands, Lakes, Ponds, and Rivers",https://www.audubon.org/field-guide/bird/garganey
Rhinoceros Auklet,Cerorhinca monocerata,,"A chunky dark seabird, related to the puffins, common at times off the northern Pacific Coast. Often unsuspicious, and boats may approach it rather closely on the water. If pressed, it dives and swims powerfully underwater. Although its takeoff appears clumsy and laborious, it is a fast flier, and may fly long distances to feeding areas daily. The 'horn' on the bill, responsible for the bird's name, grows annually in early spring and is shed in late summer.",Least Concern,"Coasts and Shorelines, Open Ocean",https://www.audubon.org/field-guide/bird/rhinoceros-auklet
Dusky Flycatcher,Empidonax oberholseri,,"Among the confusing Empidonax flycatchers in the west, birders know the Dusky as a bird in the middle. It is intermediate in size and shape between the Hammond's and Gray flycatchers; its breeding habitat is also intermediate, at middle elevations in the mountains, where tall conifers stand among shrubby low thickets. Pioneer ornithologists in the west often confused the Dusky and Gray flycatchers, and they debated for years whether or not there were really two species.",Least Concern,"Arroyos and Canyons, Forests and Woodlands, High Mountains, Shrublands, Savannas, and Thickets",https://www.audubon.org/field-guide/bird/dusky-flycatcher
Shiny Cowbird,Molothrus bonariensis,,"Originally native to South America, this little blackbird spread gradually through the West Indies in recent decades, island-hopping north through the Lesser Antilles and then west toward Cuba. It arrived in Florida in 1985, and has become locally common there, with some seen elsewhere in the Southeast. Like other cowbirds, this species is a parasite, so its arrival in our area was not welcomed by conservationists.",Least Concern,"Coasts and Shorelines, Fields, Meadows, and Grasslands, Shrublands, Savannas, and Thickets, Urban and Suburban Habitats",https://www.audubon.org/field-guide/bird/shiny-cowbird
Roseate Tern,Sterna dougallii,,"Widespread but very local on the coasts of six continents. In North America, only on Atlantic seaboard, mainly in northeast and Florida. More strictly coastal and oceanic than most similar terns. Has a very light and buoyant flight, with relatively fast and shallow wingbeats, and often gives a musical callnote in flight. Its numbers on this continent are in a long-term decline, probably owing to a combination of reasons, and it is now considered an endangered species.",Least Concern,"Coasts and Shorelines, Open Ocean, Saltwater Wetlands",https://www.audubon.org/field-guide/bird/roseate-tern
Redwing,Turdus iliacus,,"Inhabiting open woods and fields across Europe and northern Asia, this medium-sized thrush occurs regularly as close to our area as Iceland. Contrary to what its name might suggest, the red in its wing is only on the underside; on the perched bird, it shows up only as a rust color along the flanks. The Redwing has strayed to northeastern North America several times, mostly in winter.",Least Concern,"Forests and Woodlands, Shrublands, Savannas, and Thickets",https://www.audubon.org/field-guide/bird/redwing
Hepatic Tanager,Piranga flava,,"In mountain forests of the Southwest, this tanager is fairly common in summer among the pines and oaks. Members of a pair are often found foraging together, moving about rather slowly in the tall pines as they search deliberately for insects in the foliage. The name 'Hepatic' is a reference to the color of the male, a more liver-red or duller shade than that of our other red tanagers.",Least Concern,"Arroyos and Canyons, Forests and Woodlands, High Mountains",https://www.audubon.org/field-guide/bird/hepatic-tanager
Iceland Gull,Larus glaucoides,,"A pale northern gull, about the size of American Herring Gull but more graceful and maneuverable in flight. Despite its name, it occurs in Iceland only during the winter. The typical white-winged form nests only in Greenland, while the ""Kumlien's"" form, with gray in the wingtips, nests in northeastern Canada and winters mostly in eastern Canada and the northeastern United States. The ""Thayer's"" form, considered a separate species until recently, nests in far northern Canada and winters mainly along the Pacific Coast. The latter two forms seem to intergrade where their nesting ranges come in contact in the Baffin Island region of Arctic Canada.",Least Concern,"Coasts and Shorelines, Freshwater Wetlands, Lakes, Ponds, and Rivers, Landfills and Dumps, Open Ocean, Saltwater Wetlands, Tundra and Boreal Habitats",https://www.audubon.org/field-guide/bird/iceland-gull
Rivoli's Hummingbird,Eugenes fulgens,,"A big, long-billed hummingbird of forests in the southwestern mountains. Almost as large as the Blue-throated Hummingbird found in the same ranges, the Rivoli's is not usually so aggressive or conspicuous, but some individuals are very pugnacious in defending flower patches or feeders, even fighting with the Blue-throat at times. In hovering flight, the wingbeats are almost slow enough for the human eye to see.",Least Concern,"Arroyos and Canyons, Forests and Woodlands",https://www.audubon.org/field-guide/bird/rivolis-hummingbird
Red-footed Booby,Sula sula,,"Found in tropical seas around the world, this long-winged seabird is only a very rare visitor to North America. Most records are from Florida, especially around the islands of the Dry Tortugas, but the species has also been found off the California coast.",Least Concern,"Coasts and Shorelines, Open Ocean",https://www.audubon.org/field-guide/bird/red-footed-booby
Ashy Storm-Petrel,Hydrobates homochroa,,"A small seabird with a limited range, breeding only on offshore islands from central California to northern Baja, and dispersing only short distances at sea. Flies low over the waves with relatively shallow wingbeats. Of the various all-dark storm-petrels on the west coast, this one is medium-sized and slightly paler than the others.",Endangered,"Coasts and Shorelines, Open Ocean",https://www.audubon.org/field-guide/bird/ashy-storm-petrel
Gray-crowned Rosy-Finch,Leucosticte tephrocotis,,"The most widespread of our three species of rosy-finches, the Gray-crown nests from the islands of western Alaska south to the high mountains of California and northern Montana. Different populations are variable in size and in the amount of gray on the heads of the males.",Least Concern,"Coasts and Shorelines, Desert and Arid Habitats, High Mountains, Tundra and Boreal Habitats",https://www.audubon.org/field-guide/bird/gray-crowned-rosy-finch
Lucy's Warbler,Leiothlypis luciae,,"Small, pale, and plain, this bird is unimpressive in appearance, but it is notable as the only warbler that nests in the hot deserts of the Southwest. Lucy's Warblers return to the desert early in spring, and pairs can be found foraging in brush along the washes even before the mesquites have leafed out. Unlike most warblers, they raise their young in cavities, placing their nests inside old woodpecker holes or under loose slabs of bark.",Least Concern,"Arroyos and Canyons, Desert and Arid Habitats, Shrublands, Savannas, and Thickets",https://www.audubon.org/field-guide/bird/lucys-warbler
Hook-billed Kite,Chondrohierax uncinatus,,"A recent arrival north of the border, this sluggish tropical hawk was first found in southern Texas in 1964, and has been a regular resident there since 1975. May be seen sailing over the trees or sometimes soaring high, but spends much of its time down within the canopy of the woods, where it searches for its staple food of tree snails. Usually in pairs or family groups in Texas, but has been seen in flocks in South America.",Least Concern,"Forests and Woodlands, Shrublands, Savannas, and Thickets",https://www.audubon.org/field-guide/bird/hook-billed-kite
White-tipped Dove,Leptotila verreauxi,,"The birder visiting woods of southern Texas may be startled to realize that some of the doves walking about on the ground are of an unfamiliar type. Round-bodied and short-tailed, they keep close to cover; if disturbed, they walk away rapidly through the undergrowth, or fly away low with a whistle of wings. These White-tipped Doves are the northernmost representatives of a distinctive group, the genus Leptotila, widespread in wooded areas in the American tropics.",Least Concern,"Forests and Woodlands, Shrublands, Savannas, and Thickets",https://www.audubon.org/field-guide/bird/white-tipped-dove
Spectacled Eider,Somateria fischeri,,"An uncommon and poorly known eider of the high Arctic, its distribution centered on the Bering Sea. Generally in small flocks. Tends to occur mainly in areas where travel is difficult for humans -- boggy tundra in summer, at sea around pack ice at other times; its winter range far out in the Bering Sea was unconfirmed until recently. Its remote habitat and bizarre, ghostly appearance contribute to its aura of mystery.",Near Threatened,"Coasts and Shorelines, Open Ocean, Tundra and Boreal Habitats",https://www.audubon.org/field-guide/bird/spectacled-eider
Lawrence's Goldfinch,Spinus lawrencei,,"Uncommon and somewhat mysterious is this little finch of the far West. It nests very locally in the foothills of California and Baja, often near streams in fairly dry country. Its winter range varies: in some years, flocks spread well eastward across the southwestern deserts, but the reasons for these 'invasions' are not well understood. The twittering song of the male Lawrence's Goldfinch often includes brief imitations of the voices of other birds.",Least Concern,"Arroyos and Canyons, Desert and Arid Habitats, Forests and Woodlands, Shrublands, Savannas, and Thickets",https://www.audubon.org/field-guide/bird/lawrences-goldfinch
Black-vented Oriole,Icterus wagleri,,"In Mexico and Central America, this large oriole lives mostly in dry forest or semi-open woods of the foothills and lower mountain slopes. It has wandered north into Texas and Arizona on only a few occasions, but some of these strays have remained for months.",Least Concern,"Forests and Woodlands, Shrublands, Savannas, and Thickets",https://www.audubon.org/field-guide/bird/black-vented-oriole
Colima Warbler,Leiothlypis crissalis,,"In our area, this Mexican species occurs only in Big Bend National Park in western Texas. There it is fairly common in summer at upper elevations in the Chisos Mountains, but seeing it requires a day-long hike or a lengthy horseback ride. The Colima is larger than most warblers and tends to be sluggish, foraging deliberately in the dense undergrowth or in the lower levels of the oaks.",Least Concern,"Forests and Woodlands, Shrublands, Savannas, and Thickets",https://www.audubon.org/field-guide/bird/colima-warbler
Common Pauraque,Nyctidromus albicollis,,"After sunset, in the brushy woods of southern Texas, a hoarse wheezing whistle is heard from here and there in the undergrowth. As dusk settles in, a silhouetted bird flutters and glides silently through the clearings. This is the Pauraque, a common tropical nightjar. If disturbed by day at its resting place in dense thickets, it flutters away on a zigzag course, showing white flashes in the wings and tail.",Least Concern,"Forests and Woodlands, Shrublands, Savannas, and Thickets",https://www.audubon.org/field-guide/bird/common-pauraque
Rose-throated Becard,Pachyramphus aglaiae,,"This tropical bird barely extends north of the Mexican border in summer. In our area it occurs regularly only along a few streams in southern Arizona. It is also found in southern Texas, especially in winter. Quiet and inconspicuous, it is easily overlooked as it perches high within the canopy of the trees, occasionally fluttering out to pick an insect from the foliage. Its massive, football-shaped nest, swinging at the end of a dangling branch, is often the first clue that becards are present.",Least Concern,"Arroyos and Canyons, Forests and Woodlands",https://www.audubon.org/field-guide/bird/rose-throated-becard
Mexican Chickadee,Poecile sclateri,,"The southernmost of the chickadees, this bird is common in mountain forests over much of Mexico. It barely enters our area, crossing the border only to the Chiricahua Mountains of Arizona and the Animas Mountains of New Mexico. Most birders encounter it in the Chiricahuas, where it ranges through the Douglas-firs at high elevations. In late summer, after nesting, Mexican Chickadees join mixed flocks with various warblers and other birds.",Least Concern,"Arroyos and Canyons, Forests and Woodlands",https://www.audubon.org/field-guide/bird/mexican-chickadee
Wrentit,Chamaea fasciata,,"In the chaparral, the dense low brush that grows along the Pacific seaboard, Wrentits are often heard and seldom seen. Pairs of these long-tailed little birds move about actively in the depths of the thickets, rarely perching in the open or flying across small clearings. They are remarkably sedentary; a bird may spend its entire adult life in an area of just a couple of acres.",Least Concern,"Forests and Woodlands, Shrublands, Savannas, and Thickets",https://www.audubon.org/field-guide/bird/wrentit
Chestnut-collared Longspur,Calcarius ornatus,,"Male Chestnut-collared Longspurs can be found in summer singing their flight-songs over the northern prairies. In winter, flocks invade the grasslands of the Southwest. They can be hard to see well on the ground, flushing when a birder approaches, to swirl away over the fields with soft musical callnotes; they are more easily observed when they come to drink at ponds.",Vulnerable,"Desert and Arid Habitats, Fields, Meadows, and Grasslands",https://www.audubon.org/field-guide/bird/chestnut-collared-longspur
Baikal Teal,Sibirionetta formosa,,"A beautiful small duck of eastern Asia, rarely wandering into Alaska. Has been reported at a few other sites in North America, but these birds could have been escapes from captivity. Baikal Teal apparently has been decreasing on its native range in recent decades, and it may be reaching Alaska less frequently now than in the past.",Least Concern,"Coasts and Shorelines, Freshwater Wetlands, Lakes, Ponds, and Rivers, Saltwater Wetlands",https://www.audubon.org/field-guide/bird/baikal-teal
Nelson's Sparrow,Ammospiza nelsoni,,"This marsh-loving sparrow was formerly lumped with Saltmarsh Sparrow under the name Sharp-tailed Sparrow. The Nelson's has an unusual distribution, breeding both far inland and on the coast. In the interior, it summers in freshwater marshes on the northern Great Plains. It also nests in coastal marshes along the southern edges of Hudson Bay and James Bay, and on the Atlantic Coast from Quebec south to Maine.",Least Concern,"Coasts and Shorelines, Fields, Meadows, and Grasslands, Freshwater Wetlands, Saltwater Wetlands",https://www.audubon.org/field-guide/bird/nelsons-sparrow
Tropical Kingbird,Tyrannus melancholicus,,"One of the most widespread birds of the American tropics, this species reaches the United States mainly in southern Arizona. There it is the quietest and most inconspicuous of the four kingbird species present. Beginning in the early 1990s a few Tropicals were also found in southern Texas, where they overlap with their close relative, Couch's Kingbird. Unlike most kingbirds, Tropicals are seldom found in flocks.",Least Concern,"Arroyos and Canyons, Desert and Arid Habitats, Forests and Woodlands, Lakes, Ponds, and Rivers",https://www.audubon.org/field-guide/bird/tropical-kingbird
Black-tailed Gnatcatcher,Polioptila melanura,,"This long-tailed little insect-eater is at home in the desert southwest, even in arid scrub and creosote bush flats where there are few other birds. Black-tailed Gnatcatchers live in pairs all year, foraging together actively in the low brush. They stay in contact with each other using a wide variety of calls; some of these calls sound suspiciously like imitations of other desert birds, such as Verdin or Black-throated Sparrow.",Least Concern,"Desert and Arid Habitats, Shrublands, Savannas, and Thickets",https://www.audubon.org/field-guide/bird/black-tailed-gnatcatcher
Slaty-backed Gull,Larus schistisagus,,"Resident along the coastlines of northeastern Asia, this big gull is a regular summer visitor to western Alaska, usually in small numbers. In winter, it has appeared as a rare stray at widely scattered points in North America, as far east as New England and as far south as Texas.",Least Concern,"Coasts and Shorelines, Landfills and Dumps, Saltwater Wetlands, Tundra and Boreal Habitats",https://www.audubon.org/field-guide/bird/slaty-backed-gull
Williamson's Sapsucker,Sphyrapicus thyroideus,,"A strikingly marked woodpecker of western mountains. May be found nesting in the same aspen groves as Red-naped or Red-breasted sapsuckers, but also occurs in pure coniferous forest. Quiet and inconspicuous at most times, although its staccato drumming and nasal mewing calls may be noticeable in spring. Males and females of this woodpecker look so different that they were first described to science as two separate species.",Least Concern,"Arroyos and Canyons, Forests and Woodlands, High Mountains",https://www.audubon.org/field-guide/bird/williamsons-sapsucker
Yellow-headed Amazon,Amazona oratrix,,"Because it can be trained to imitate human speech, this chunky parrot has been popular in the cage bird trade. As a result, it is now endangered in the wild. Formerly widespread in Mexico and northern Central America, it is thought to have declined by 90 percent in it native range. Escaped cage birds have established feral flocks around Los Angeles and San Diego, California, and locally in southern Florida. The few seen in southern Texas are probably escapees also, although some might possibly be wild strays from the population in Mexico.",Endangered,"Forests and Woodlands, Urban and Suburban Habitats",https://www.audubon.org/field-guide/bird/yellow-headed-parrot
Black-whiskered Vireo,Vireo altiloquus,,"Found almost throughout the West Indies in summer, this is the Caribbean replacement for our common Red-eyed Vireo. In our area, Black-whiskered Vireos are summer residents mainly in southern Florida. There they can be heard singing constantly in the coastal mangrove tangles on hot days in May. Natives of the Caribbean know this bird well by voice, often giving it nicknames that suggest the short emphatic phrases of the song, such as 'John-Philip' or 'Whip-Tom-Kelly.'",Least Concern,"Forests and Woodlands, Saltwater Wetlands, Shrublands, Savannas, and Thickets",https://www.audubon.org/field-guide/bird/black-whiskered-vireo
